{
  "schema_version": 1,
  "component": "prismdrake-shell",
  "component_kind": "visible_shell",
  "implementation_status": "experimental",
  "mandatory_core_startup": true,
  "runtime_dependency_state": "planned_unmeasured",
  "dependencies": [
    {
      "name": "qtbase",
      "gentoo_atom": "dev-qt/qtbase:6",
      "scope": "mandatory_runtime",
      "relationship": "direct",
      "feature": "visible_shell_foundation",
      "requirement_status": "implemented",
      "version": {
        "declared_minimum": "6.4",
        "verified_minimum": "6.4.2",
        "observed": "6.11.1",
        "evidence": "verified_component"
      },
      "packaging_status": "observed_gentoo",
      "license_review": "reviewed",
      "fallback": null,
      "reason": "The Experimental immutable settings/theme projection and panel window host directly use system Qt Core and GUI, while the launcher controller and passive launcher, task, and notification presentation adapters use Qt Core. Ubuntu 24.04 CI verifies Qt 6.4.2 as the oldest tested common-API component version; Gentoo 6.11.1 supplies current reference evidence."
    },
    {
      "name": "qtdeclarative",
      "gentoo_atom": "dev-qt/qtdeclarative:6",
      "scope": "mandatory_runtime",
      "relationship": "direct",
      "feature": "qml_and_qt_quick",
      "requirement_status": "implemented",
      "version": {
        "declared_minimum": "6.4",
        "verified_minimum": "6.4.2",
        "observed": "6.11.1-r1",
        "evidence": "verified_component"
      },
      "packaging_status": "observed_gentoo",
      "license_review": "reviewed",
      "fallback": null,
      "reason": "The Experimental panel and notification modules directly use system QML, Qt Quick, and Quick Controls. Ubuntu 24.04 CI verifies Qt 6.4.2 as the oldest tested common-API component version; Gentoo 6.11.1-r1 supplies current reference evidence."
    },
    {
      "name": "nlohmann-json",
      "gentoo_atom": "dev-cpp/nlohmann_json",
      "scope": "build",
      "relationship": "direct",
      "feature": "settings_snapshot_validation",
      "requirement_status": "implemented",
      "version": {
        "declared_minimum": "3.11",
        "verified_minimum": null,
        "observed": "3.12.0-r1",
        "evidence": "observed_reference"
      },
      "packaging_status": "observed_gentoo",
      "license_review": "reviewed",
      "fallback": null,
      "reason": "The shell's strict complete-snapshot parser includes the system nlohmann JSON header and recompiles canonical typed state; it is not an installed runtime library."
    },
    {
      "name": "basu",
      "gentoo_atom": "sys-libs/basu",
      "scope": "mandatory_runtime",
      "relationship": "direct",
      "feature": "settings_snapshot_transport",
      "requirement_status": "implemented",
      "version": {
        "declared_minimum": null,
        "verified_minimum": null,
        "observed": "0.2.1",
        "evidence": "observed_reference"
      },
      "packaging_status": "observed_gentoo",
      "license_review": "reviewed",
      "fallback": "Ubuntu and compatible hosts may use the selected API-compatible libsystemd sd-bus provider; one build links exactly one provider.",
      "reason": "The event-driven shell settings client directly uses Prismdrake's selected sd-bus provider for the Experimental complete-snapshot contract."
    },
    {
      "name": "dbus",
      "gentoo_atom": "sys-apps/dbus",
      "scope": "mandatory_runtime",
      "relationship": "tool",
      "feature": "settings_snapshot_transport",
      "requirement_status": "implemented",
      "version": {
        "declared_minimum": null,
        "verified_minimum": null,
        "observed": "1.16.2",
        "evidence": "observed_reference"
      },
      "packaging_status": "observed_gentoo",
      "license_review": "reviewed",
      "fallback": null,
      "reason": "The shell consumes settings over the user session message bus; isolated tests use dbus-run-session while project code links the selected sd-bus provider rather than libdbus."
    },
    {
      "name": "libxcb",
      "gentoo_atom": "x11-libs/libxcb",
      "scope": "mandatory_runtime",
      "relationship": "transitive",
      "feature": "x11_shell_surface",
      "requirement_status": "implemented",
      "version": {
        "declared_minimum": null,
        "verified_minimum": null,
        "observed": "1.17.0",
        "evidence": "observed_reference"
      },
      "packaging_status": "observed_gentoo",
      "license_review": "reviewed",
      "fallback": null,
      "reason": "The Experimental Qt panel host and event-driven task controller consume the internal standards-only X11 adapter, which links system libxcb for dedicated event connections, RandR topology, EWMH task observation, and checked dock and window-manager requests. The complete shell runtime closure remains unmeasured."
    }
  ],
  "unresolved": [
    {
      "area": "runtime_closure",
      "reason": "The typed theme, launcher, task, and notification adapters, asynchronous launcher controller, live settings-snapshot client, panel and notification QML modules, panel window host, and EWMH task controller are implemented, but the complete shell executable, runtime wiring, and direct and transitive closure still require measurement."
    },
    {
      "area": "accessibility_runtime",
      "reason": "AT-SPI behavior was observed in the spike, but production accessibility linkage and packaging must be measured before declaration."
    }
  ]
}
