{
  "schema_version": 1,
  "component": "prismdrake-settingsd",
  "component_kind": "core_service",
  "implementation_status": "experimental",
  "mandatory_core_startup": true,
  "runtime_dependency_state": "measured",
  "dependencies": [
    {
      "name": "tomlplusplus",
      "gentoo_atom": "dev-cpp/tomlplusplus",
      "scope": "mandatory_runtime",
      "relationship": "direct",
      "feature": "configuration_parsing",
      "requirement_status": "implemented",
      "version": {
        "declared_minimum": null,
        "verified_minimum": null,
        "observed": "3.4.0",
        "evidence": "verified_component"
      },
      "packaging_status": "observed_gentoo",
      "license_review": "reviewed",
      "fallback": null,
      "reason": "The display-free PD1 configuration module directly uses the system toml++ library for strict version-1 parsing; no supported minimum has been measured."
    },
    {
      "name": "nlohmann-json",
      "gentoo_atom": "dev-cpp/nlohmann_json",
      "scope": "build",
      "relationship": "direct",
      "feature": "theme_token_parsing",
      "requirement_status": "implemented",
      "version": {
        "declared_minimum": "3.11",
        "verified_minimum": null,
        "observed": "3.12.0-r1",
        "evidence": "verified_component"
      },
      "packaging_status": "observed_gentoo",
      "license_review": "reviewed",
      "fallback": null,
      "reason": "The display-free PD1 theme parser directly includes the system nlohmann JSON header; the header-only dependency is compiled into the internal theme target and is not an installed runtime library."
    },
    {
      "name": "basu",
      "gentoo_atom": "sys-libs/basu",
      "scope": "mandatory_runtime",
      "relationship": "direct",
      "feature": "settings_ipc",
      "requirement_status": "implemented",
      "version": {
        "declared_minimum": null,
        "verified_minimum": null,
        "observed": "0.2.1",
        "evidence": "verified_component"
      },
      "packaging_status": "observed_gentoo",
      "license_review": "reviewed",
      "fallback": "Ubuntu CI uses the API-compatible libsystemd sd-bus provider; one build links exactly one provider.",
      "reason": "The Experimental settings service directly uses the system sd-bus API. Gentoo builds prefer and link basu; the provider boundary does not download, vendor, or link a second D-Bus client library."
    },
    {
      "name": "dbus",
      "gentoo_atom": "sys-apps/dbus",
      "scope": "mandatory_runtime",
      "relationship": "tool",
      "feature": "settings_ipc",
      "requirement_status": "implemented",
      "version": {
        "declared_minimum": null,
        "verified_minimum": null,
        "observed": "1.16.2",
        "evidence": "verified_component"
      },
      "packaging_status": "observed_gentoo",
      "license_review": "reviewed",
      "fallback": null,
      "reason": "The Experimental service requires a user session message bus and its isolated tests use dbus-run-session and dbus-daemon. Project code links the selected sd-bus provider, not libdbus."
    },
    {
      "name": "libxcb",
      "gentoo_atom": "x11-libs/libxcb",
      "scope": "mandatory_runtime",
      "relationship": "direct",
      "feature": "xsettings_publication",
      "requirement_status": "planned",
      "version": {
        "declared_minimum": null,
        "verified_minimum": null,
        "observed": "1.17.0",
        "evidence": "observed_reference"
      },
      "packaging_status": "observed_gentoo",
      "license_review": "reviewed",
      "fallback": null,
      "reason": "PD1 targets X11 and assigns XSettings publication to settingsd; production linkage is not implemented or measured."
    }
  ],
  "unresolved": [
    {
      "area": "runtime_closure",
      "reason": "The complete Gentoo basu dynamic closure is recorded, but supported minimum provider and broker versions remain unmeasured."
    }
  ]
}
