{
  "schema_version": 1,
  "component": "prismdrake-x11",
  "component_kind": "internal_library",
  "implementation_status": "experimental",
  "mandatory_core_startup": true,
  "runtime_dependency_state": "measured",
  "dependencies": [
    {
      "name": "libxcb",
      "gentoo_atom": "x11-libs/libxcb",
      "scope": "mandatory_runtime",
      "relationship": "direct",
      "feature": "x11_transport",
      "requirement_status": "implemented",
      "version": {
        "declared_minimum": null,
        "verified_minimum": null,
        "observed": "1.17.0",
        "evidence": "verified_component"
      },
      "packaging_status": "observed_gentoo",
      "license_review": "reviewed",
      "fallback": null,
      "reason": "The toolkit-neutral X11 adapter directly uses system core XCB for checked connection setup, fixed atom interning, bounded property reads, verified EWMH discovery, and observational root events."
    },
    {
      "name": "xcb-randr",
      "gentoo_atom": "x11-libs/libxcb",
      "scope": "mandatory_runtime",
      "relationship": "direct",
      "feature": "randr_output_discovery",
      "requirement_status": "implemented",
      "version": {
        "declared_minimum": null,
        "verified_minimum": null,
        "observed": "1.17.0",
        "evidence": "verified_component"
      },
      "packaging_status": "observed_gentoo",
      "license_review": "reviewed",
      "fallback": "When the X server does not provide usable RandR state, the validated core-root rectangle supplies the reduced single-output PD1 topology.",
      "reason": "The X11 adapter directly links libxcb-randr.so.0 from x11-libs/libxcb for bounded RandR version negotiation, output discovery, primary-output queries, and topology-change event selection."
    },
    {
      "name": "xorg-server",
      "gentoo_atom": "x11-base/xorg-server",
      "scope": "test",
      "relationship": "tool",
      "feature": "isolated_x11_integration",
      "requirement_status": "implemented",
      "version": {
        "declared_minimum": null,
        "verified_minimum": null,
        "observed": "21.1.24",
        "evidence": "verified_component"
      },
      "packaging_status": "observed_gentoo",
      "license_review": "reviewed",
      "fallback": "A separately controlled X server may run the same transport integration binary.",
      "reason": "The deterministic integration harness starts Xvfb through its displayfd interface with server reset disabled and exercises transport, property, EWMH, and root-event behavior without requiring a window manager."
    }
  ],
  "unresolved": [
    {
      "area": "minimum_versions",
      "reason": "Supported minimum core libxcb, xcb-randr, and Xorg server versions remain unmeasured; the recorded versions are component observations rather than supported minima."
    },
    {
      "area": "remaining_adapter_scope",
      "reason": "Standard window-manager requests, dock and strut property publication, work-area verification, and stale task-model records remain later PD1 work."
    }
  ]
}
